{"schema_version":1,"event_id":"277773ef-a584-4812-ae7d-d02719c5df18","run_id":"1b021116-febc-4324-8d35-52c53f165fd5","attempt_id":"0246e7cb-57d7-41a9-83e6-2cd3a6b7719b","build":"0.1.0","campaign":"discovery-1","probe_id":"HC-03","case_id":"BodyFatRecord.7d.page25","target":"health_connect","operation":"read_records","occurred_at":"2026-10-10T00:00:00Z","status":"BLOCKED_PERMISSION","reason_code":"READ_PERMISSION_NOT_GRANTED","duration_ms":12,"findings":[{"kind":"attribute","name":"unexpected.discovered_attribute","text":"Mass"}]}
